{
  "schema_version": "1.0.0",
  "id": "sentinel",
  "name": "Code & App Reviewer Sentinel",
  "version": "1.0.0",
  "author": {
    "name": "Möbius"
  },
  "description": "Review a real installed app, a public App Store repository, or pasted code against a bug report.",
  "category": "Code & QA",
  "tags": [
    "Security",
    "Code quality",
    "Mobile"
  ],
  "icon": {
    "kind": "monogram",
    "value": "S"
  },
  "persona": {
    "system_prompt": "Review selected source code and a pasted bug report for quality, credential leaks, unsafe execution, mobile layout risks and unnecessarily broad capabilities. Cite concrete files and lines. Never claim to have run code or completed a security audit.",
    "playbook": [
      "Inspect the selected installed app, fetched public Store repository, or pasted code without executing it.",
      "Compare the bug report with concrete source locations.",
      "Report a 0–100 health score with observed warnings, actionable fixes and verification still needed."
    ],
    "skills": []
  },
  "capabilities": {
    "permissions": [
      {
        "scope": "code.review",
        "required": true,
        "reason": "Send selected source and bug report to the owner provider for review"
      },
      {
        "scope": "filesystem.read",
        "required": false,
        "reason": "Read declared source files of an explicitly selected installed app"
      },
      {
        "scope": "web.fetch",
        "required": false,
        "reason": "Fetch an explicitly selected public App Store repository"
      }
    ],
    "tools": [
      {
        "name": "read_evidence",
        "required": true
      },
      {
        "name": "run_checks",
        "required": true
      },
      {
        "name": "write_patch",
        "required": true
      }
    ]
  },
  "triggers": {
    "manual": {
      "enabled": true
    },
    "mention": {
      "enabled": false,
      "handle": "@sentinel"
    },
    "cron": {
      "enabled": false,
      "expression": "0 8 * * *",
      "timezone": "Europe/Rome"
    },
    "events": [
      {
        "name": "bug_report_inbox",
        "enabled": false
      }
    ]
  },
  "execution": {
    "timeout_seconds": 300,
    "max_concurrent_runs": 1,
    "input_mode": "user_supplied",
    "max_steps": 14,
    "max_estimated_cost_usd": 2.0
  },
  "feedback": {
    "log": {
      "enabled": true,
      "retention_days": 30,
      "include_inputs": false
    },
    "ratings": {
      "enabled": true,
      "allow_notes": true
    },
    "memory": {
      "capture": [
        "outcome",
        "feedback"
      ],
      "refinement_mode": "suggest_only",
      "requires_owner_approval": true
    }
  },
  "character": {
    "class": "Guardian",
    "palette": {
      "primary": "#5b7cff",
      "secondary": "#26357f",
      "accent": "#ffd34d",
      "skin": "#f2c79b",
      "hair": "#3a2a20"
    },
    "sprite_seed": 1307,
    "superpowers": [
      {
        "name": "Source Sight",
        "scope": "filesystem.read",
        "description": "Reads an installed app's declared source files, up to 120 KB, with line numbers."
      },
      {
        "name": "Repo Recall",
        "scope": "web.fetch",
        "description": "Fetches a public App Store repository pinned to one exact commit."
      },
      {
        "name": "Bug Lens",
        "scope": "code.review",
        "description": "Checks your bug report against concrete files and lines, then scores health 0–100."
      }
    ]
  }
}
